{
  "protocol_version": 1,
  "experiment_id": "550e8400-e29b-41d4-a716-446655440000",
  "iteration": 3,
  "param_dim": 4,
  "parameters": [0.12, -0.45, 1.02, -0.88],
  "energy": 1.234,
  "uncertainty": 0.031,
  "digest": "e3b0c44298fc1c149afbf4c8996fb92427ae41e4649b934ca495991b7852b855",
  "sequence_id": 42
}
